{
  "schema_version": "1.0",
  "message": "Добрый день, команда Домео! Подготовили короткий разбор сайта и демо-страницу под ваши услуги — удобно показать внутри команды. Во вложении PDF и ссылки ниже.",
  "usp": [
    "Фиксированная логика сметы на первом экране",
    "Демо под нишу строительства с формой заявки"
  ],
  "why_this_company": "У Домео сильная экспертиза в строительстве домов, но на текущем сайте заказчику сложно сразу увидеть следующий шаг и доверие к смете.",
  "links": {
    "demo": "https://domeo.leadgenerator-demos.pages.dev",
    "portfolio": "https://g4-verify-construction.leadgenerator-7sp.pages.dev",
    "audit_pdf": "offer/audit.pdf"
  }
}
